{
  "$schema": "https://json-schema.org/draft/2020-12/schema",
  "$id": "https://factory.com/factory-spec-build/build-state.schema.json",
  "title": "Build Harness State",
  "description": "Fuente única de verdad para el handoff secuencial entre agentes de construcción. La escriben build-orchestrator y los gates; la lee load-build-state.sh en cada arranque de sesión.",
  "type": "object",
  "additionalProperties": false,
  "required": ["version", "harness_phase", "scaffold", "active_slice", "history", "releases"],
  "properties": {
    "version": { "type": "string", "const": "1.0" },
    "harness_phase": {
      "type": "string",
      "enum": ["authoring", "active"],
      "description": "Señal auto-detectada e INFORMATIVA: authoring = todavía no hay package.json; active = ya existe scaffold de código. Quien manda para avanzar es `scaffold.confirmed`, no este campo."
    },
    "design_source": { "$ref": "#/$defs/design_source" },
    "scaffold": { "$ref": "#/$defs/scaffold" },
    "active_slice": {
      "description": "Slice (épica) actualmente en construcción; `null` cuando no hay ninguno abierto.",
      "oneOf": [
        { "type": "null" },
        { "$ref": "#/$defs/slice" }
      ]
    },
    "history": {
      "type": "array",
      "description": "Slices ya archivados, en el orden en que se cerraron.",
      "items": { "$ref": "#/$defs/slice" }
    },
    "releases": {
      "type": "array",
      "description": "Entradas del Release Gate (outer loop), una por línea de release del Story Map auditada en bloque.",
      "items": { "$ref": "#/$defs/release" }
    }
  },
  "$defs": {
    "design_source": {
      "type": "object",
      "additionalProperties": false,
      "description": "Gate de PROYECTO para slices con UI: certifica que existe una fuente de diseño declarada (prototipo/export). Funciona igual que `scaffold` — `confirmed` solo la enciende una persona, jamás una heurística automática. El arnés no fabrica el prototipo; si `applies` es false, todo el mecanismo queda apagado (proyecto sin UI).",
      "required": ["applies", "confirmed"],
      "properties": {
        "applies": { "type": "boolean", "description": "¿Este proyecto tiene UI que respetar? En false, el resto de los campos es N/A." },
        "confirmed": { "type": "boolean", "description": "Pasa a true únicamente cuando una persona confirmó que la fuente de diseño existe y está vigente." },
        "confirmed_by": { "type": ["string", "null"], "description": "Quién dejó la confirmación (agente o skill)." },
        "confirmed_at": { "type": ["string", "null"], "format": "date-time" },
        "source": { "type": "string", "description": "Puntero a la fuente de diseño: ruta o URL del prototipo/export (el DESIGN_SOURCE del bloque de dominio)." },
        "notes": { "type": "string", "description": "Evidencia libre, p.ej. 'prototipo en docs/… revisado esta semana'." }
      }
    },
    "scaffold": {
      "type": "object",
      "additionalProperties": false,
      "description": "Gate de PROYECTO (el Paso 1 de todos): certifica que el esqueleto runnable ya existe. Restrictivo a propósito — solo llega a confirmed=true por confirmación humana explícita (building-a-slice Fase 0 / dor-dod-gatekeeper), nunca por detección automática. El arnés no genera el scaffold, solo verifica que alguien lo confirmó.",
      "required": ["confirmed"],
      "properties": {
        "confirmed": { "type": "boolean", "description": "true solo tras confirmar explícitamente que el esqueleto runnable existe." },
        "confirmed_by": { "type": ["string", "null"], "description": "Quién dejó la confirmación (agente o skill)." },
        "confirmed_at": { "type": ["string", "null"], "format": "date-time" },
        "notes": { "type": "string", "description": "Evidencia libre, p.ej. 'el dev server arranca vacío sin errores'." }
      }
    },
    "slice": {
      "type": "object",
      "additionalProperties": false,
      "required": ["epica", "hus", "openspec_change", "branch", "phase", "gates", "updated_at", "updated_by"],
      "properties": {
        "epica": { "type": "string", "pattern": "^EP-[0-9]{3}$", "description": "Identificador de la épica; es la unidad de construcción del slice." },
        "hus": {
          "type": "array",
          "description": "HU de la épica que cubre este change (mínimo una) — trazabilidad al alcance interno.",
          "items": { "type": "string", "pattern": "^HU-[0-9]{3}$" },
          "minItems": 1,
          "uniqueItems": true
        },
        "openspec_change": { "type": "string", "pattern": "^[a-z0-9]+(-[a-z0-9]+)*$" },
        "branch": { "type": "string", "pattern": "^(feature|fix|chore)/[a-z0-9._-]+$" },
        "phase": {
          "type": "string",
          "enum": ["dor", "change", "red", "green", "refactor", "smoke", "api", "data", "dod", "pr", "archived"]
        },
        "gates": {
          "type": "object",
          "additionalProperties": false,
          "description": "Gates del inner loop (por slice): dor, tdd, journey_smoke, coherence_link, data, fidelity, api (nullable), wiring_verified, dod. Los gates pesados (stack, security, smell, ux, coherence) se cerraban por-slice en una era anterior del arnés y hoy viven agregados en releases[]; se conservan aquí como propiedades opcionales solo para poder validar historial viejo.",
          "required": ["dor", "tdd", "dod"],
          "properties": {
            "dor": { "type": "boolean" },
            "tdd": { "type": "boolean" },
            "journey_smoke": { "type": "boolean", "description": "El backbone construido hasta ahora camina end-to-end — verificado con la skill verify/run más el runner fuera-de-chat integration-check." },
            "coherence_link": { "type": "boolean", "description": "El enlace change↔épica es válido (chequeo barato de change-epic-coherence, corrido por slice)." },
            "data": { "type": "boolean" },
            "fidelity": { "type": ["boolean", "null"], "description": "Gate vivo del inner loop, computado en la fase smoke por ux-fidelity-reviewer. Aplica solo si el slice toca UI dentro de un proyecto con design_source.applies===true; si el slice no toca UI queda null aunque el proyecto sí tenga UI en general. Estricto: en slices con UI solo puede cerrarse mediante verificación visual real vía MCP de devtools de navegador (comparar screenshot de la app contra el prototipo). true = fiel (o con desviaciones justificadas por esa vía); false = desviaciones sin justificar, o la verificación visual simplemente no se hizo — un resultado inconcluso ya no cuenta como aprobado; null = no aplica (slice sin UI). No es un campo legado — los legados viven exclusivamente en releases[]." },
            "wiring_verified": { "type": "boolean", "description": "Gate de cierre del inner loop: un subagente adversarial arrancado en contexto virgen e independiente de quien escribió el código (wiring-adversarial-verifier) intentó activamente refutar el slice — stubs, rutas sin cablear, criterios de aceptación sin prueba, o items de wiring_checklist[] todavía en failing — y no encontró huecos. dod no puede pasar a true hasta que este gate lo haga primero. El dor-dod-gatekeeper lo deja en false al abrir el DoR." },
            "api": { "type": ["boolean", "null"], "description": "null cuando el slice no expone endpoints (no aplica)." },
            "ux": { "type": ["boolean", "null"], "description": "null cuando el slice no tiene UI. Campo legado: hoy la auditoría UX vive agregada en releases[]." },
            "stack": { "type": "boolean", "description": "Legado por-slice; las dependencias las vigila el hook stack-guard.sh en tiempo real, y la arquitectura se audita agregada en releases[]." },
            "security": { "type": "boolean", "description": "Legado por-slice; hoy se audita agregada en releases[]." },
            "smell": { "type": "boolean", "description": "Legado por-slice; hoy se audita agregada en releases[]." },
            "coherence": { "type": "boolean", "description": "Legado por-slice (trazabilidad three-way completa); hoy se audita agregada en releases[]." },
            "dod": { "type": "boolean" }
          }
        },
        "updated_at": { "type": "string", "format": "date-time" },
        "updated_by": { "type": "string", "description": "Agente o hook que dejó esta escritura de estado." },
        "notes": { "type": "string", "description": "Nota libre opcional — p.ej. changes o branches adicionales cuando una épica se construyó en varios pasos." },
        "reflected": { "type": "boolean", "description": "true si /build:reflect ya extrajo los aprendizajes de este slice archivado (parte del ciclo autocorrectivo). Mientras siga false o ausente, reflect-nudge.sh sugiere reflexionar al terminar la sesión." },
        "reflected_at": { "type": "string", "format": "date-time", "description": "Momento (ISO-8601 UTC) en que se reflexionó. Lo escribe /build:reflect." },
        "wiring_checklist": {
          "type": "array",
          "description": "Handoff fino del cableado: un item por cada escenario de aceptación de cada HU, y uno por cada punto de integración entre capas (SPA↔gateway↔core↔worker↔persistencia). Nace en failing y solo pasa a passing tras una prueba real ejecutada (con evidence adjunta) — nunca por inspección visual del código. Sobrevive a un reset de contexto: una sesión nueva lee lo que sigue en failing directamente del disco y no puede declarar 'listo' mientras queden items pendientes. El wiring-adversarial-verifier audita esta lista antes de encender wiring_verified. Queda ausente o vacía en slices triviales.",
          "items": {
            "type": "object",
            "additionalProperties": false,
            "required": ["id", "kind", "ref", "status"],
            "properties": {
              "id": { "type": "string", "description": "Identificador estable del item, p.ej. HU-003-AC2 o INT-spa-gateway." },
              "kind": { "type": "string", "enum": ["hu_ac", "integration_point"], "description": "hu_ac = escenario Given/When/Then de una HU; integration_point = cableado entre dos capas." },
              "ref": { "type": "string", "description": "Qué referencia exactamente: el AC (HU-XXX#escenario) o el par de capas involucrado (capaA→capaB)." },
              "status": { "type": "string", "enum": ["failing", "passing"], "description": "Nace en failing; pasa a passing únicamente tras una ejecución real que lo confirme." },
              "evidence": { "type": "string", "description": "Qué prueba/comando/salida justificó el passing. Vacío mientras siga en failing." }
            }
          }
        },
        "progress_log": {
          "type": "array",
          "description": "Bitácora append-only que sobrevive al reset de contexto: le permite a una sesión nueva, o a un flujo headless, retomar el cableado sin tener que 'confiar' en que ya estaba hecho. Complementa al historial de git y a los logs de build, no los reemplaza.",
          "items": {
            "type": "object",
            "additionalProperties": false,
            "required": ["at", "by", "note"],
            "properties": {
              "at": { "type": "string", "format": "date-time" },
              "by": { "type": "string", "description": "Agente o sesión que dejó la nota." },
              "note": { "type": "string", "description": "Hito conciso: qué se hizo y qué falta." }
            }
          }
        },
        "sub_slices": {
          "type": "array",
          "description": "Descomposición de una épica que superó el umbral de tamaño (más de 3 HU, o que toca 3 o más capas): se trocea en sub-slices verificables que se construyen de a uno, con journey_smoke en verde entre cada paso. Ausente o vacío significa épica atómica (no cruzó el umbral). También acota cuánto puede crecer wiring_checklist[] en cada paso.",
          "items": {
            "type": "object",
            "additionalProperties": false,
            "required": ["id", "title", "status"],
            "properties": {
              "id": { "type": "string", "description": "Identificador del sub-slice, p.ej. EP-003-a." },
              "title": { "type": "string" },
              "hus": { "type": "array", "items": { "type": "string", "pattern": "^HU-[0-9]{3}$" }, "description": "Subconjunto de hus[] que cubre este sub-slice en particular." },
              "status": { "type": "string", "enum": ["pending", "done"], "description": "done solo cuando su propio journey_smoke está en verde." },
              "journey_smoke": { "type": "boolean", "description": "El backbone construido hasta este sub-slice camina end-to-end." }
            }
          }
        }
      }
    },
    "release": {
      "type": "object",
      "additionalProperties": false,
      "required": ["release_id", "epicas", "status", "created_at", "updated_by"],
      "properties": {
        "release_id": { "type": "string", "description": "Corresponde a una línea de release del Story Map, p.ej. R1-mvp." },
        "epicas": {
          "type": "array",
          "description": "Épicas que integran esta release.",
          "items": { "type": "string", "pattern": "^EP-[0-9]{3}$" },
          "minItems": 1,
          "uniqueItems": true
        },
        "status": { "type": "string", "enum": ["pending", "passed", "failed"] },
        "gates": {
          "type": "object",
          "additionalProperties": false,
          "description": "Gates pesados del Release Gate (outer loop). Quedan ausentes mientras status siga en pending.",
          "properties": {
            "security": { "type": ["boolean", "null"] },
            "smell": { "type": ["boolean", "null"] },
            "ux": { "type": ["boolean", "null"], "description": "null cuando la release no toca UI." },
            "coherence": { "type": ["boolean", "null"] },
            "stack_arch": { "type": ["boolean", "null"] },
            "integration": { "type": ["boolean", "null"], "description": "Journey completo recorrido contra dependencias reales, no mockeadas." }
          }
        },
        "created_at": { "type": "string", "format": "date-time" },
        "updated_by": { "type": "string" }
      }
    }
  }
}
