{
  "version": "1.0",
  "harness_phase": "active",
  "scaffold": {
    "confirmed": true,
    "confirmed_by": "kevin",
    "confirmed_at": "2026-07-21T00:00:00Z",
    "notes": "Restaurado desde historial git (commit 602fff7) tras perdida accidental del archivo de estado (working state gitignored). Scaffold minimo Go bajo src/ (src/go.mod, src/cmd/gateway, src/internal/...). Verificado: go build ./... 0, go vet ./... 0, go test ./... 0, binario responde /health->200 y /metrics->200. Gates de codigo desbloqueados."
  },
  "design_source": {
    "applies": true,
    "confirmed": false,
    "confirmed_by": null,
    "confirmed_at": null,
    "source": "Dashboard React/Next (Fase 2) - docs/13-tech-prd/api-llm-gateway.md#6-diseno-e-interfaz-y-cli",
    "notes": "Restaurado desde historial. Fase 1 MVP sin UI (endpoint JSON). Dashboard React llega en Fase 2 (EP-EVO-003); prototipo aun no existe, confirmed=false. No bloquea slices backend-puro como EP-EVO-001 (mismo precedente que EP-010): el gate de fidelidad queda N/A hasta que exista fuente visual y el slice la toque."
  },
  "active_slice": {
    "epica": "EP-EVO-001",
    "titulo": "Adapters de Proveedores Gratuitos Curados",
    "hus": ["HU-EVO-001", "HU-EVO-002", "HU-EVO-003", "HU-EVO-004", "HU-EVO-005"],
    "layer": "business",
    "openspec_change": "adapters-proveedores-gratuitos-curados",
    "branch": "feature/ep-evo-001-adapters-gratuitos",
    "phase": "pr",
    "gates": {
      "dor": true,
      "tdd": true,
      "journey_smoke": true,
      "coherence_link": true,
      "data": null,
      "api": null,
      "fidelity": null,
      "wiring_verified": true,
      "dod": true
    },
    "wiring_checklist": [
      { "id": "HU-EVO-001-AC1", "kind": "hu_ac", "ref": "HU-EVO-001#1 adapter OpenAI-compatible (Groq)", "status": "passing", "evidence": "src/internal/adapter/generic/adapter_test.go:TestChat_OpenAIFormat_Groq -- go test ./internal/adapter/generic/... -v: PASS" },
      { "id": "HU-EVO-001-AC2", "kind": "hu_ac", "ref": "HU-EVO-001#2 adapter Claude-compatible", "status": "passing", "evidence": "src/internal/adapter/generic/adapter_test.go:TestChat_ClaudeFormat -- PASS" },
      { "id": "HU-EVO-001-AC3", "kind": "hu_ac", "ref": "HU-EVO-001#3 spec invalido -> ErrInvalidProviderSpec", "status": "passing", "evidence": "src/internal/adapter/generic/adapter_test.go:TestNew_InvalidSpec_ReturnsErrInvalidProviderSpec -- PASS" },
      { "id": "HU-EVO-001-AC4", "kind": "hu_ac", "ref": "HU-EVO-001#4 headers extra por proveedor", "status": "passing", "evidence": "src/internal/adapter/generic/adapter_test.go:TestChat_ExtraHeaders_DoNotOverrideAuth -- PASS" },
      { "id": "HU-EVO-001-AC5", "kind": "hu_ac", "ref": "HU-EVO-001#5 timeout por adapter distinto del global", "status": "passing", "evidence": "src/internal/adapter/generic/adapter_test.go:TestChat_PerAdapterTimeout_IndependentFromGlobal -- PASS" },
      { "id": "HU-EVO-002-AC1", "kind": "hu_ac", "ref": "HU-EVO-002#1 Registry.Load carga free-tier.yaml (5 proveedores)", "status": "passing", "evidence": "src/internal/registry/freetier_test.go:TestMergeFreeTier_ValidYAML_ExposesProviders -- go test ./internal/registry/... -v: PASS. Archivo real config/providers/free-tier.yaml creado con Groq/Cerebras/Mistral/Gemini/Cloudflare AI" },
      { "id": "HU-EVO-002-AC2", "kind": "hu_ac", "ref": "HU-EVO-002#2 free-tier.yaml sobrescribe config.yaml", "status": "passing", "evidence": "src/internal/registry/freetier_test.go:TestMergeFreeTier_OverwritesExistingProvider -- PASS" },
      { "id": "HU-EVO-002-AC3", "kind": "hu_ac", "ref": "HU-EVO-002#3 YAML malformado -> ErrInvalidConfig fail-fast", "status": "passing", "evidence": "src/internal/registry/freetier_test.go:TestMergeFreeTier_MalformedYAML_ReturnsErrInvalidConfig -- PASS" },
      { "id": "HU-EVO-002-AC4", "kind": "hu_ac", "ref": "HU-EVO-002#4 proveedor sin modelo default excluido del scoring", "status": "passing", "evidence": "src/internal/registry/freetier_test.go:TestMergeFreeTier_EmptyModels_ExcludedFromScoring -- PASS" },
      { "id": "HU-EVO-002-AC5", "kind": "hu_ac", "ref": "HU-EVO-002#5 quota_hint negativo -> remaining=0", "status": "passing", "evidence": "src/internal/registry/freetier_test.go:TestMergeFreeTier_NegativeQuotaHint_ExposedForQuotaManager + src/internal/quota/init_test.go:TestInitFromRegistry_ZeroOrNegativeHint_TreatedAsExhausted -- PASS" },
      { "id": "HU-EVO-003-AC1", "kind": "hu_ac", "ref": "HU-EVO-003#1 conformance_test itera todos los providers", "status": "passing", "evidence": "src/internal/adapter/conformance_generic_test.go:TestConformance_AllFreeTierProviderSpecs_NormalizeResponse (5 subtests table-driven) -- PASS" },
      { "id": "HU-EVO-003-AC2", "kind": "hu_ac", "ref": "HU-EVO-003#2 respuesta normalizada (Content/Model/Usage)", "status": "passing", "evidence": "src/internal/adapter/conformance_generic_test.go: subtests groq/cerebras/mistral-free/claude-compat verifican resp.Content normalizado -- PASS" },
      { "id": "HU-EVO-003-AC3", "kind": "hu_ac", "ref": "HU-EVO-003#3 spec sin modelo -> ErrNoModelAvailable", "status": "passing", "evidence": "src/internal/adapter/conformance_generic_test.go: subtest 'sin-modelo' -- PASS" },
      { "id": "HU-EVO-003-AC4", "kind": "hu_ac", "ref": "HU-EVO-003#4 timeout en test aborta sin bloquear suite", "status": "passing", "evidence": "src/internal/adapter/conformance_generic_test.go:TestConformance_SlowProvider_TimesOutWithoutBlockingSuite -- PASS (0.20s)" },
      { "id": "HU-EVO-003-AC5", "kind": "hu_ac", "ref": "HU-EVO-003#5 specs en paralelo sin race conditions", "status": "passing", "evidence": "t.Parallel() en subtests + go test ./... -race sobre todo el repo: 100% verde, sin data races reportadas" },
      { "id": "HU-EVO-004-AC1", "kind": "hu_ac", "ref": "HU-EVO-004#1 proveedor recupera tras 429 (health check 200)", "status": "passing", "evidence": "src/internal/health/retire429_test.go:TestRetireOn429_RecoversAfterHealthCheckOK -- PASS" },
      { "id": "HU-EVO-004-AC2", "kind": "hu_ac", "ref": "HU-EVO-004#2 retiro temporal respetando Retry-After", "status": "passing", "evidence": "src/internal/health/retire429_test.go:TestRetireOn429_RespectsRetryAfter (unit, RetryAfter inyectado directo al Monitor) + src/integration/retry_after_test.go:TestRetryAfter_PropagaDesdeAdapterHastaHealthMonitor (end-to-end real: httptest.Server 429 con header Retry-After:60 -> generic.Adapter.checkStatus parsea con parseRetryAfter -> adapter.ProviderError.RetryAfter=60s -> failover.Engine.Complete detecta 429 y llama e.OnRateLimited(providerID, pe.RetryAfter) -- antes hardcodeado a 0 -- -> health.Monitor.RetireOn429 recibe 60s real) -- go test ./integration/... -run TestRetryAfter -v: PASS. Cierra hueco reportado por wiring-adversarial-verifier: antes failover.go linea 122 pasaba retryAfter=0 siempre, ignorando el header real del proveedor." },
      { "id": "HU-EVO-004-AC3", "kind": "hu_ac", "ref": "HU-EVO-004#3 429 sin Retry-After -> default 30s", "status": "passing", "evidence": "src/internal/health/retire429_test.go:TestRetireOn429_NoRetryAfter_DefaultsTo30s -- PASS" },
      { "id": "HU-EVO-004-AC4", "kind": "hu_ac", "ref": "HU-EVO-004#4 429 mid-stream aborta sin failover transparente", "status": "passing", "evidence": "src/internal/health/retire429_test.go:TestRetireOn429_DoesNotAffectInFlightHealthyDecision -- PASS" },
      { "id": "HU-EVO-004-AC5", "kind": "hu_ac", "ref": "HU-EVO-004#5 backoff exponencial ante 429 repetidos", "status": "passing", "evidence": "src/internal/health/retire429_test.go:TestRetireOn429_ExponentialBackoff (30s->60s->120s->tope 120s) -- PASS" },
      { "id": "HU-EVO-005-AC1", "kind": "hu_ac", "ref": "HU-EVO-005#1 init remaining desde quota_hint YAML", "status": "passing", "evidence": "src/internal/quota/init_test.go:TestInitFromRegistry_UsesQuotaHint -- PASS" },
      { "id": "HU-EVO-005-AC2", "kind": "hu_ac", "ref": "HU-EVO-005#2 header learned sobrescribe quota_hint", "status": "passing", "evidence": "src/internal/quota/init_test.go:TestInitFromRegistry_LearnedValueOverridesHint -- PASS" },
      { "id": "HU-EVO-005-AC3", "kind": "hu_ac", "ref": "HU-EVO-005#3 quota_hint<=0 -> agotado, excluido de Router", "status": "passing", "evidence": "src/internal/quota/init_test.go:TestInitFromRegistry_ZeroOrNegativeHint_TreatedAsExhausted -- PASS" },
      { "id": "HU-EVO-005-AC4", "kind": "hu_ac", "ref": "HU-EVO-005#4 proveedor sin quota_hint -> default 1M", "status": "passing", "evidence": "src/internal/quota/init_test.go:TestInitFromRegistry_MissingHint_DefaultsTo1M -- PASS" },
      { "id": "HU-EVO-005-AC5", "kind": "hu_ac", "ref": "HU-EVO-005#5 reinicio restaura learned quota desde PostgreSQL", "status": "failing", "evidence": "src/internal/quota/init_test.go:TestRestoreRemaining_TakesPrecedenceOverQuotaHint prueba solo la funcion RestoreRemaining() con un valor inyectado a mano -- NO hay lectura real de PostgreSQL, cmd/gateway/main.go no conecta a ninguna base de datos (quota.NewInMemoryManager() sin backing store). AC5 diferido por acuerdo explicito de equipo (ver docs/04-historias/HU-EVO-005-quota-manager-inicializar-contadores.md#nota-de-alcance-ac5-diferido-2026-07-23) a HU-EVO-008 (Persistencia async PostgreSQL, EP-EVO-002), que es el slice correcto para cablear el store real. Reclasificado a failing por el arreglo de sesion 2026-07-23 tras reporte de wiring-adversarial-verifier; no bloquea el DoD de EP-EVO-001 porque el diferimiento es documentado y explicito, no un stub oculto." },
      { "id": "INT-adapter-registry", "kind": "integration_point", "ref": "adapter generico (HU-EVO-001) <- Registry.LoadFromFile (HU-EVO-002)", "status": "passing", "evidence": "src/internal/integration/ep_evo_001_wiring_test.go:TestWiring_AdapterGenerico_ConstruidoDesdeRegistry -- generic.New() construido con BaseURL/APIKey resueltos de Registry.MergeFreeTier, Chat end-to-end contra httptest -- PASS" },